{"$schema":"https://json-schema.org/draft/2020-12/schema","additionalProperties":false,"allOf":[{"if":{"properties":{"status":{"const":"mismatch_outputs"}},"required":["status"]},"then":{"required":["first_divergence","numeric_diff_stats"]}}],"properties":{"baseline_run_id":{"minLength":1,"type":"string"},"candidate_run_id":{"minLength":1,"type":"string"},"checks":{"items":{"additionalProperties":false,"properties":{"conformance_id":{"pattern":"^SPEC-[0-9]+(\\.[0-9]+)?-[A-Z0-9_-]+$","type":"string"},"detail":{"type":"string"},"outcome":{"enum":["pass","fail","warn"],"type":"string"}},"required":["conformance_id","outcome","detail"],"type":"object"},"minItems":1,"type":"array"},"environment_diffs":{"additionalProperties":false,"properties":{"baseline_hardware_fingerprint":{"pattern":"^sha256:[a-f0-9]{64}$","type":"string"},"baseline_runtime_closure_digest":{"pattern":"^sha256:[a-f0-9]{64}$","type":"string"},"candidate_hardware_fingerprint":{"pattern":"^sha256:[a-f0-9]{64}$","type":"string"},"candidate_runtime_closure_digest":{"pattern":"^sha256:[a-f0-9]{64}$","type":"string"},"hardware_fingerprint_equal":{"type":"boolean"},"runtime_closure_digest_equal":{"type":"boolean"},"version_diffs":{"items":{"type":"string"},"type":"array"}},"required":["runtime_closure_digest_equal","version_diffs","hardware_fingerprint_equal","baseline_runtime_closure_digest","candidate_runtime_closure_digest","baseline_hardware_fingerprint","candidate_hardware_fingerprint"],"type":"object"},"first_divergence":{"additionalProperties":false,"properties":{"detail":{"minLength":1,"type":"string"},"location":{"minLength":1,"type":"string"},"observable":{"enum":["tokens","logits"],"type":"string"}},"required":["observable","location","detail"],"type":"object"},"generated_at":{"format":"date-time","type":"string"},"numeric_diff_stats":{"additionalProperties":false,"properties":{"max_abs_diff":{"minimum":0,"type":"number"},"max_rel_diff":{"minimum":0,"type":"number"},"mismatched_count":{"minimum":0,"type":"integer"},"total_compared":{"minimum":0,"type":"integer"}},"required":["max_abs_diff","max_rel_diff","mismatched_count","total_compared"],"type":"object"},"status":{"enum":["conformant","non_conformant_hardware","non_conformant_software","mismatch_outputs"],"type":"string"},"summary":{"minLength":1,"type":"string"},"verify_report_version":{"const":"v1","type":"string"},"verify_summary_path":{"minLength":1,"type":"string"}},"required":["verify_report_version","generated_at","baseline_run_id","candidate_run_id","status","summary","checks","environment_diffs","verify_summary_path"],"title":"verify_report.v1","type":"object"}
