{"baseline_run_id":"run-0001","candidate_run_id":"run-0001","checks":[{"conformance_id":"SPEC-13-VERIFY-REPORT","detail":"report emitted","outcome":"pass"}],"environment_diffs":{"baseline_hardware_fingerprint":"sha256:3333333333333333333333333333333333333333333333333333333333333333","baseline_runtime_closure_digest":"sha256:bbbbbbbbbbbbbbbbbbbbbbbbbbbbbbbbbbbbbbbbbbbbbbbbbbbbbbbbbbbbbbbb","candidate_hardware_fingerprint":"sha256:3333333333333333333333333333333333333333333333333333333333333333","candidate_runtime_closure_digest":"sha256:bbbbbbbbbbbbbbbbbbbbbbbbbbbbbbbbbbbbbbbbbbbbbbbbbbbbbbbbbbbbbbbb","hardware_fingerprint_equal":true,"runtime_closure_digest_equal":true,"version_diffs":[]},"generated_at":"2026-03-05T00:06:00Z","status":"conformant","summary":"No divergence detected","verify_report_version":"v1","verify_summary_path":"verify_summary.txt"}
